id,question_type,question,choices,answer
TSCP_001,mc,"Alice says: 'I'm going to the movies tonight.' Bob replies: 'Have fun!' What is Bob's theory of mind about Alice's statement?","A) She is telling the truth | B) She is being polite (white lie) | C) She is joking | D) She doesn't know Alice's plans",A
TSCP_002,mc,"A company announces a sudden policy change. Employees are concerned. You need to communicate this to your team. What is your first action?","A) Schedule team meeting immediately | B) Draft FAQ for employees | C) Send company-wide email | D) Meet with concerned employees individually",A
TSCP_003,mc,"You receive an invitation with RSVP deadline. The event conflicts with another commitment. What should you do?","A) Decline politely with explanation | B) Accept if more important and decline other | C) Ask about alternative time | D) Reply immediately | E) Propose compromise",A
TSCP_004,mc,"A colleague consistently interrupts your focused work. How do you respond?","A) Politely ask for scheduled discussion | B) Set office hours for focus time | C) Use do-not-disturb sign | D) Address pattern with supervisor",A
TSCP_005,mc,"You need to explain a complex concept to a client. The client seems confused. What is your approach?","A) Ask checking questions first | B) Use simple language initially | C) Use analogies from their domain | D) Provide examples to confirm understanding",B
